{
 "versao": 2,
 "fonte": "Open-Meteo Historical Weather API (reanálise ERA5, ECMWF/Copernicus), dados horários a 10 m",
 "url": "https://open-meteo.com/en/docs/historical-weather-api",
 "licenca": "CC BY 4.0 · uso não comercial gratuito; atribuição: Weather data by Open-Meteo.com",
 "nota": "Velocidades do ERA5 (grade de 0,25°) ficam cerca de 1,5 m/s abaixo da NASA POWER (MERRA-2); a sazonalidade coincide (máximo em setembro, mínimo em março/abril). Servem para o clima regional, não para o vento local entre edificações.",
 "local": {
  "nome": "Fortaleza",
  "lat": -3.73,
  "lon": -38.52,
  "gradeLat": -3.76,
  "gradeLon": -38.53
 },
 "periodo": {
  "inicio": "2015-01-01",
  "fim": "2024-12-31"
 },
 "coletadoEm": "2026-10-13",
 "setores": 16,
 "calmaLimite": 0.5,
 "conferencia": {
  "fonte": "NASA POWER, climatologia WS10M (m/s)",
  "ws10m": [
   5.82,
   5.27,
   4.73,
   4.56,
   5.23,
   6.09,
   6.92,
   7.79,
   8.16,
   7.92,
   7.53,
   6.88
  ]
 },
 "meses": [
  {
   "mes": 1,
   "horas": 7440,
   "velMedia": 4.08,
   "calmaria": 0.1,
   "dirMedia": 96,
   "dirPredominante": 90,
   "rosa": [
    {
     "dir": 0,
     "freq": 0.3,
     "vel": 1.8
    },
    {
     "dir": 22.5,
     "freq": 1,
     "vel": 2.2
    },
    {
     "dir": 45,
     "freq": 4.6,
     "vel": 3
    },
    {
     "dir": 67.5,
     "freq": 15.5,
     "vel": 3.6
    },
    {
     "dir": 90,
     "freq": 41,
     "vel": 4.3
    },
    {
     "dir": 112.5,
     "freq": 26.5,
     "vel": 4.6
    },
    {
     "dir": 135,
     "freq": 7.7,
     "vel": 3.7
    },
    {
     "dir": 157.5,
     "freq": 2,
     "vel": 2.6
    },
    {
     "dir": 180,
     "freq": 0.6,
     "vel": 2.2
    },
    {
     "dir": 202.5,
     "freq": 0.2,
     "vel": 1.5
    },
    {
     "dir": 225,
     "freq": 0.1,
     "vel": 1.2
    },
    {
     "dir": 247.5,
     "freq": 0,
     "vel": 0.8
    },
    {
     "dir": 270,
     "freq": 0,
     "vel": 1.1
    },
    {
     "dir": 292.5,
     "freq": 0.1,
     "vel": 1.3
    },
    {
     "dir": 315,
     "freq": 0.1,
     "vel": 1.2
    },
    {
     "dir": 337.5,
     "freq": 0.1,
     "vel": 1.8
    }
   ],
   "velHora": [
    3.44,
    3.41,
    3.39,
    3.38,
    3.38,
    3.42,
    3.51,
    4,
    4.61,
    4.71,
    4.91,
    5.1,
    5.22,
    5.22,
    5.16,
    5.03,
    4.8,
    4.42,
    3.72,
    3.46,
    3.44,
    3.42,
    3.43,
    3.44
   ],
   "dirHora": [
    88,
    93,
    98,
    104,
    109,
    115,
    120,
    118,
    114,
    111,
    106,
    101,
    97,
    93,
    90,
    87,
    85,
    83,
    83,
    84,
    83,
    79,
    81,
    84
   ]
  },
  {
   "mes": 2,
   "horas": 6792,
   "velMedia": 3.61,
   "calmaria": 0.4,
   "dirMedia": 98,
   "dirPredominante": 90,
   "rosa": [
    {
     "dir": 0,
     "freq": 0.9,
     "vel": 1.8
    },
    {
     "dir": 22.5,
     "freq": 2,
     "vel": 2
    },
    {
     "dir": 45,
     "freq": 5.3,
     "vel": 2.6
    },
    {
     "dir": 67.5,
     "freq": 15.1,
     "vel": 3.3
    },
    {
     "dir": 90,
     "freq": 33.2,
     "vel": 4
    },
    {
     "dir": 112.5,
     "freq": 24.4,
     "vel": 4.3
    },
    {
     "dir": 135,
     "freq": 9.8,
     "vel": 3.5
    },
    {
     "dir": 157.5,
     "freq": 3.5,
     "vel": 2.5
    },
    {
     "dir": 180,
     "freq": 2,
     "vel": 2
    },
    {
     "dir": 202.5,
     "freq": 0.8,
     "vel": 1.4
    },
    {
     "dir": 225,
     "freq": 0.7,
     "vel": 1.4
    },
    {
     "dir": 247.5,
     "freq": 0.3,
     "vel": 1.4
    },
    {
     "dir": 270,
     "freq": 0.4,
     "vel": 1.7
    },
    {
     "dir": 292.5,
     "freq": 0.3,
     "vel": 1.7
    },
    {
     "dir": 315,
     "freq": 0.4,
     "vel": 2
    },
    {
     "dir": 337.5,
     "freq": 0.5,
     "vel": 2.4
    }
   ],
   "velHora": [
    2.96,
    2.9,
    2.88,
    2.87,
    2.98,
    3.02,
    3.06,
    3.48,
    4.03,
    4.21,
    4.36,
    4.54,
    4.64,
    4.65,
    4.66,
    4.5,
    4.34,
    4.05,
    3.34,
    3.09,
    3.07,
    3.03,
    3.01,
    3.02
   ],
   "dirHora": [
    91,
    96,
    104,
    110,
    115,
    122,
    126,
    127,
    121,
    115,
    108,
    103,
    98,
    93,
    89,
    86,
    83,
    82,
    82,
    83,
    83,
    79,
    81,
    86
   ]
  },
  {
   "mes": 3,
   "horas": 7440,
   "velMedia": 3.08,
   "calmaria": 0.8,
   "dirMedia": 101,
   "dirPredominante": 90,
   "rosa": [
    {
     "dir": 0,
     "freq": 2.3,
     "vel": 2.3
    },
    {
     "dir": 22.5,
     "freq": 2.7,
     "vel": 2.1
    },
    {
     "dir": 45,
     "freq": 5.3,
     "vel": 2.5
    },
    {
     "dir": 67.5,
     "freq": 12.5,
     "vel": 3.1
    },
    {
     "dir": 90,
     "freq": 26.5,
     "vel": 3.6
    },
    {
     "dir": 112.5,
     "freq": 20.1,
     "vel": 3.7
    },
    {
     "dir": 135,
     "freq": 12.1,
     "vel": 3.1
    },
    {
     "dir": 157.5,
     "freq": 7,
     "vel": 2.6
    },
    {
     "dir": 180,
     "freq": 3.9,
     "vel": 2.2
    },
    {
     "dir": 202.5,
     "freq": 1.7,
     "vel": 1.6
    },
    {
     "dir": 225,
     "freq": 1.1,
     "vel": 1.2
    },
    {
     "dir": 247.5,
     "freq": 0.7,
     "vel": 1.4
    },
    {
     "dir": 270,
     "freq": 0.9,
     "vel": 1.5
    },
    {
     "dir": 292.5,
     "freq": 0.6,
     "vel": 1.4
    },
    {
     "dir": 315,
     "freq": 0.7,
     "vel": 1.5
    },
    {
     "dir": 337.5,
     "freq": 1.1,
     "vel": 2
    }
   ],
   "velHora": [
    2.46,
    2.41,
    2.4,
    2.43,
    2.49,
    2.5,
    2.63,
    2.94,
    3.33,
    3.47,
    3.7,
    3.86,
    4.07,
    4.11,
    4.12,
    4.07,
    3.88,
    3.52,
    2.84,
    2.61,
    2.58,
    2.55,
    2.56,
    2.52
   ],
   "dirHora": [
    98,
    108,
    117,
    122,
    128,
    135,
    140,
    137,
    128,
    120,
    111,
    103,
    95,
    90,
    85,
    82,
    80,
    81,
    84,
    86,
    88,
    81,
    86,
    92
   ]
  },
  {
   "mes": 4,
   "horas": 7200,
   "velMedia": 3.2,
   "calmaria": 0.3,
   "dirMedia": 115,
   "dirPredominante": 112.5,
   "rosa": [
    {
     "dir": 0,
     "freq": 1,
     "vel": 2
    },
    {
     "dir": 22.5,
     "freq": 1.9,
     "vel": 2.1
    },
    {
     "dir": 45,
     "freq": 3.1,
     "vel": 2.2
    },
    {
     "dir": 67.5,
     "freq": 6.2,
     "vel": 2.6
    },
    {
     "dir": 90,
     "freq": 20.5,
     "vel": 3.5
    },
    {
     "dir": 112.5,
     "freq": 26.3,
     "vel": 3.9
    },
    {
     "dir": 135,
     "freq": 18.3,
     "vel": 3.6
    },
    {
     "dir": 157.5,
     "freq": 11.3,
     "vel": 2.9
    },
    {
     "dir": 180,
     "freq": 5.2,
     "vel": 2.1
    },
    {
     "dir": 202.5,
     "freq": 2.2,
     "vel": 1.5
    },
    {
     "dir": 225,
     "freq": 1.4,
     "vel": 1.2
    },
    {
     "dir": 247.5,
     "freq": 0.5,
     "vel": 1.5
    },
    {
     "dir": 270,
     "freq": 0.4,
     "vel": 1.2
    },
    {
     "dir": 292.5,
     "freq": 0.4,
     "vel": 1.6
    },
    {
     "dir": 315,
     "freq": 0.5,
     "vel": 1.3
    },
    {
     "dir": 337.5,
     "freq": 0.4,
     "vel": 1.7
    }
   ],
   "velHora": [
    2.47,
    2.55,
    2.54,
    2.58,
    2.69,
    2.75,
    2.96,
    3.2,
    3.59,
    3.77,
    4.02,
    4.15,
    4.24,
    4.26,
    4.17,
    4.08,
    3.88,
    3.37,
    2.81,
    2.65,
    2.66,
    2.5,
    2.49,
    2.5
   ],
   "dirHora": [
    117,
    124,
    131,
    137,
    142,
    146,
    150,
    145,
    138,
    131,
    122,
    114,
    107,
    102,
    98,
    94,
    92,
    93,
    97,
    99,
    103,
    101,
    104,
    110
   ]
  },
  {
   "mes": 5,
   "horas": 7440,
   "velMedia": 3.89,
   "calmaria": 0.1,
   "dirMedia": 122,
   "dirPredominante": 112.5,
   "rosa": [
    {
     "dir": 0,
     "freq": 0,
     "vel": 1.5
    },
    {
     "dir": 22.5,
     "freq": 0.1,
     "vel": 1.8
    },
    {
     "dir": 45,
     "freq": 0.3,
     "vel": 2.3
    },
    {
     "dir": 67.5,
     "freq": 1.7,
     "vel": 3.1
    },
    {
     "dir": 90,
     "freq": 17.8,
     "vel": 3.9
    },
    {
     "dir": 112.5,
     "freq": 34.1,
     "vel": 4.2
    },
    {
     "dir": 135,
     "freq": 24.4,
     "vel": 4
    },
    {
     "dir": 157.5,
     "freq": 16,
     "vel": 3.6
    },
    {
     "dir": 180,
     "freq": 4.4,
     "vel": 2.5
    },
    {
     "dir": 202.5,
     "freq": 0.7,
     "vel": 1.6
    },
    {
     "dir": 225,
     "freq": 0.2,
     "vel": 1.1
    },
    {
     "dir": 247.5,
     "freq": 0.1,
     "vel": 1
    },
    {
     "dir": 270,
     "freq": 0,
     "vel": 1.3
    },
    {
     "dir": 292.5,
     "freq": 0,
     "vel": 0.6
    },
    {
     "dir": 315,
     "freq": 0,
     "vel": 0.6
    },
    {
     "dir": 337.5,
     "freq": 0,
     "vel": 1
    }
   ],
   "velHora": [
    3.14,
    3.2,
    3.27,
    3.36,
    3.42,
    3.49,
    3.63,
    3.93,
    4.46,
    4.77,
    5.01,
    5.04,
    5.03,
    4.94,
    4.86,
    4.72,
    4.39,
    3.79,
    3.33,
    3.2,
    3.16,
    2.97,
    3.02,
    3.13
   ],
   "dirHora": [
    121,
    126,
    131,
    136,
    140,
    144,
    148,
    146,
    140,
    137,
    131,
    125,
    119,
    113,
    109,
    105,
    102,
    101,
    104,
    105,
    108,
    109,
    112,
    116
   ]
  },
  {
   "mes": 6,
   "horas": 7200,
   "velMedia": 4.47,
   "calmaria": 0,
   "dirMedia": 125,
   "dirPredominante": 112.5,
   "rosa": [
    {
     "dir": 0,
     "freq": 0,
     "vel": 0.6
    },
    {
     "dir": 22.5,
     "freq": 0,
     "vel": 0
    },
    {
     "dir": 45,
     "freq": 0.1,
     "vel": 2.5
    },
    {
     "dir": 67.5,
     "freq": 0.8,
     "vel": 3.4
    },
    {
     "dir": 90,
     "freq": 13.9,
     "vel": 4.4
    },
    {
     "dir": 112.5,
     "freq": 35.4,
     "vel": 4.6
    },
    {
     "dir": 135,
     "freq": 27.5,
     "vel": 4.7
    },
    {
     "dir": 157.5,
     "freq": 18.6,
     "vel": 4.4
    },
    {
     "dir": 180,
     "freq": 3.3,
     "vel": 3.1
    },
    {